{
  "contract_version": "4",
  "metadata": {
    "producer": "trading-engine",
    "purpose": "fill clipping conformance fixture"
  },
  "run_id": "fill-clipped",
  "base_currency": "USD",
  "initial_cash": [
    { "currency": "USD", "amount": "550" }
  ],
  "instruments": [
    {
      "instrument_id": "clip-equity",
      "symbol": "CLIP",
      "quote_currency": "USD",
      "tick_size": "0.01",
      "lot_size": "1"
    }
  ],
  "risk": {
    "max_order_quantity": "1000",
    "max_long_position": "1000",
    "max_short_position": "1000",
    "max_gross_exposure": "1000000000",
    "max_leverage": "1",
    "initial_margin_bps": 5000,
    "maintenance_margin_bps": 2500,
    "short_borrow_bps": 100
  },
  "execution": {
    "model": "completed_bar_v1",
    "participation_bps": 10000,
    "fixed_fee": "10",
    "fee_bps": 0
  },
  "max_internal_events": 1000,
  "schedule": [
    {
      "after_slice_sequence": "1",
      "intents": [
        {
          "type": "submit_order",
          "instrument_id": "clip-equity",
          "side": "buy",
          "quantity": "10",
          "order_kind": "market",
          "limit_price": null
        }
      ]
    }
  ],
  "slices": [
    {
      "slice_sequence": "1",
      "start_at": "2026-02-02T14:30:00Z",
      "end_at": "2026-02-02T21:00:00Z",
      "available_at": "2026-02-02T21:00:01Z",
      "received_at": "2026-02-02T21:00:02Z",
      "bars": [
        { "instrument_id": "clip-equity", "open": "50", "high": "50", "low": "50", "close": "50", "volume": "100" }
      ],
      "fx_rates": [{ "currency": "USD", "rate": "1" }],
      "corporate_actions": []
    },
    {
      "slice_sequence": "2",
      "start_at": "2026-02-03T14:30:00Z",
      "end_at": "2026-02-03T21:00:00Z",
      "available_at": "2026-02-03T21:00:01Z",
      "received_at": "2026-02-03T21:00:02Z",
      "bars": [
        { "instrument_id": "clip-equity", "open": "100", "high": "100", "low": "100", "close": "100", "volume": "100" }
      ],
      "fx_rates": [{ "currency": "USD", "rate": "1" }],
      "corporate_actions": []
    }
  ]
}
